{
  "channel": "official",
  "content": {
    "changelog": {
      "mediaType": "text/markdown",
      "sha256": "30c1d4443a6a690fc1519cb4b506794726e95c4b5a6f342f350a5d6bb75469b0",
      "size": 139,
      "sourceUrl": "https://raw.githubusercontent.com/lapismd/lapis-plugins/8a0b4648ca934a64480c01c9116609e5e28afa73/packages/bookmarks/CHANGELOG.md",
      "url": "https://registry.lapis.md/v1/content/bookmarks/changelog.md"
    },
    "overview": {
      "mediaType": "text/markdown",
      "sha256": "95b75c38bed2aabe33db28a10f29a92489d3e6252f086a7be7ec6acb96ecb139",
      "size": 657,
      "sourceUrl": "https://raw.githubusercontent.com/lapismd/lapis-plugins/8a0b4648ca934a64480c01c9116609e5e28afa73/packages/bookmarks/README.md",
      "url": "https://registry.lapis.md/v1/content/bookmarks/overview.md"
    }
  },
  "description": "Bookmark files, folders, searches, and groups",
  "highlights": [
    "Bookmark files, folders, searches, and grouped destinations.",
    "Open saved workspace locations from one compact panel.",
    "Organize frequently used resources without changing vault content."
  ],
  "id": "bookmarks",
  "latestVersion": "0.1.2",
  "license": "AGPL-3.0-or-later",
  "links": {
    "documentation": "https://github.com/lapismd/lapis-plugins/tree/main/packages/bookmarks#readme",
    "homepage": "https://github.com/lapismd/lapis-plugins/tree/main/packages/bookmarks#readme",
    "issues": "https://github.com/lapismd/lapis-plugins/issues",
    "repository": "https://github.com/lapismd/lapis-plugins"
  },
  "name": "Bookmarks",
  "owner": {
    "name": "Lapis Notes",
    "url": "https://github.com/lapismd/lapis-plugins",
    "verified": true
  },
  "readme": {
    "sha256": "95b75c38bed2aabe33db28a10f29a92489d3e6252f086a7be7ec6acb96ecb139",
    "size": 657,
    "url": "https://registry.lapis.md/v1/content/bookmarks/overview.md"
  },
  "readmeUrl": "https://raw.githubusercontent.com/lapismd/lapis-plugins/8a0b4648ca934a64480c01c9116609e5e28afa73/packages/bookmarks/README.md",
  "schemaVersion": 1,
  "signatures": [
    {
      "alg": "ed25519",
      "keyId": "lapis-registry-2026-06",
      "sig": "8u+Hi5bBqCufAmP9BtqQ4UgWDHDPdlFZmHqhoByoUtTN9SARYs8AK5/Vfh1ms+sXfC1UxK65Qax0qcfPS3slCg=="
    }
  ],
  "status": "active",
  "versions": {
    "0.1.2": {
      "bundle": {
        "downloadUrl": "../../download/bookmarks/0.1.2",
        "sha256": "2fb723286717273df303a26242c1040adb81e66c9d0e77e40668fa44266d4ec5",
        "size": 457091,
        "url": "https://github.com/lapismd/lapis-plugins/releases/download/bookmarks%400.1.2/bookmarks-0.1.2.lapis-plugin"
      },
      "minAppVersion": "0.1.0",
      "platforms": [
        "web",
        "electron"
      ],
      "releasedAt": "2026-08-29T09:36:10.000Z",
      "version": "0.1.2"
    }
  }
}
