{
  "channel": "official",
  "description": "Markdown linting diagnostics for Lapis notes.",
  "id": "lapis-markdown-lint",
  "latestVersion": "2026.6.6",
  "name": "Markdown Lint",
  "owner": {
    "name": "Lapis Notes",
    "verified": true
  },
  "readmeUrl": "https://raw.githubusercontent.com/lapismd/lapis-plugins/main/packages/markdown-lint/README.md",
  "schemaVersion": 1,
  "signatures": [
    {
      "alg": "ed25519",
      "keyId": "lapis-registry-2026-06",
      "sig": "T160dHkkOzUnaBv3vuRIIpWUR6YH3RxxlMZ+bWOwcyr978bPb+oBE9sM7a+A2z0cfV4uQ6qNGNwh6iAFzXF8Dw=="
    }
  ],
  "status": "active",
  "versions": {
    "2026.6.6": {
      "bundle": {
        "downloadUrl": "../../download/lapis-markdown-lint/2026.6.6",
        "sha256": "2791b1e8ae25352c587090d7853d29d6802b8b725c1d7793ea8b5d960ec6b1bc",
        "size": 51432,
        "url": "https://github.com/lapis-notes/releases/releases/download/official-plugin-assets-lapis-markdown-lint-2026.6.6/lapis-markdown-lint-2026.6.6.lapis-plugin"
      },
      "minAppVersion": "1.7.7",
      "platforms": [
        "web",
        "electron"
      ],
      "releasedAt": "2026-06-06T22:48:26Z",
      "version": "2026.6.6"
    }
  }
}
