{
  "channel": "official",
  "description": "Presentation mode for markdown notes.",
  "id": "lapis-slides",
  "latestVersion": "2026.6.1",
  "name": "Slides",
  "owner": {
    "name": "Lapis Notes",
    "verified": true
  },
  "readmeUrl": "https://code.ju.ma/lapis-notes/lapis/raw/branch/main/packages/plugins/plugin-slides/README.md",
  "schemaVersion": 1,
  "signatures": [
    {
      "alg": "ed25519",
      "keyId": "lapis-registry-2026-06",
      "sig": "P4yQI/RQ/EtFjERn3rwc7f5ibEfTWX9gDm6LSCkQQwnrIywAVnqNxamRwv6uHEC9SPAYqgT1lh9wjGww20GbDg=="
    }
  ],
  "status": "active",
  "versions": {
    "2026.6.1": {
      "files": [
        {
          "path": "app.css",
          "sha256": "0d186f8658d7afb0210f77815551798108790fee5928d8cdd6e5300999e5a420",
          "size": 417561,
          "url": "https://code.ju.ma/lapis-notes/lapis/releases/download/official-plugin-assets-2026-06-01/lapis-slides-2026.6.1-file-YXBwLmNzcw"
        },
        {
          "path": "main.es.js",
          "sha256": "4802bc829cee64abd906a6b6e9d9e82668abce7ff9fc88261d44e1194be67c13",
          "size": 320260,
          "url": "https://code.ju.ma/lapis-notes/lapis/releases/download/official-plugin-assets-2026-06-01/lapis-slides-2026.6.1-file-bWFpbi5lcy5qcw"
        },
        {
          "path": "main.js",
          "sha256": "6bebf54bd898edad66f8ff9e54e37edf21aa81a3baea008e455c29fe4364b7d8",
          "size": 269458,
          "url": "https://code.ju.ma/lapis-notes/lapis/releases/download/official-plugin-assets-2026-06-01/lapis-slides-2026.6.1-file-bWFpbi5qcw"
        },
        {
          "path": "main.umd.js",
          "sha256": "44bd2d793ea4df6db6dc4e549a3a31654f837507463219769b509484984f8bb0",
          "size": 269757,
          "url": "https://code.ju.ma/lapis-notes/lapis/releases/download/official-plugin-assets-2026-06-01/lapis-slides-2026.6.1-file-bWFpbi51bWQuanM"
        },
        {
          "path": "manifest.json",
          "sha256": "d1717e40633589c9a680520ac627ea4cda5136bfe89f1f5a148dc9fcf817e2b9",
          "size": 249,
          "url": "https://code.ju.ma/lapis-notes/lapis/releases/download/official-plugin-assets-2026-06-01/lapis-slides-2026.6.1-file-bWFuaWZlc3QuanNvbg"
        },
        {
          "path": "styles-entry.js",
          "sha256": "01ba4719c80b6fe911b091a7c05124b64eeece964e09c058ef8f9805daca546b",
          "size": 1,
          "url": "https://code.ju.ma/lapis-notes/lapis/releases/download/official-plugin-assets-2026-06-01/lapis-slides-2026.6.1-file-c3R5bGVzLWVudHJ5Lmpz"
        },
        {
          "optional": true,
          "path": "styles.css",
          "sha256": "8093a9313101193cb93810a71b226f285a111698658156f5a5de47843e7da231",
          "size": 563927,
          "url": "https://code.ju.ma/lapis-notes/lapis/releases/download/official-plugin-assets-2026-06-01/lapis-slides-2026.6.1-file-c3R5bGVzLmNzcw"
        }
      ],
      "minAppVersion": "1.7.7",
      "platforms": [
        "web",
        "electron"
      ],
      "releaseManifest": {
        "sha256": "81c9339afd03a1f2d10a94e0a489a67a303999d79dd3c3ca9a89ecfa00dbcd6f",
        "size": 2195,
        "url": "https://code.ju.ma/lapis-notes/lapis/releases/download/official-plugin-assets-2026-06-01/lapis-slides-2026.6.1-release.signed.json"
      },
      "releasedAt": "2026-05-31T00:00:00.000Z",
      "version": "2026.6.1"
    }
  }
}
