{
  "channel": "official",
  "content": {
    "changelog": {
      "mediaType": "text/markdown",
      "sha256": "dfcdd171eb549a5c9325a79e0233417ad3d68b4aae058e8fd841cb4e1ebc6fc4",
      "size": 143,
      "sourceUrl": "https://raw.githubusercontent.com/lapismd/lapis-plugins/8a0b4648ca934a64480c01c9116609e5e28afa73/packages/source-editor/CHANGELOG.md",
      "url": "https://registry.lapis.md/v1/content/lapis-source-editor/changelog.md"
    },
    "overview": {
      "mediaType": "text/markdown",
      "sha256": "b7436c4c70b3c638e86e70ba8d62d8d79fbfd7894706898c2188c10dd936a09b",
      "size": 689,
      "sourceUrl": "https://raw.githubusercontent.com/lapismd/lapis-plugins/8a0b4648ca934a64480c01c9116609e5e28afa73/packages/source-editor/README.md",
      "url": "https://registry.lapis.md/v1/content/lapis-source-editor/overview.md"
    }
  },
  "description": "Source editing for text, JSON, and YAML files",
  "highlights": [
    "Edit text, JSON, and YAML files with syntax-aware source views.",
    "Open supported files through normal workspace routing.",
    "Keep edits synchronized through the Lapis vault lifecycle."
  ],
  "id": "lapis-source-editor",
  "latestVersion": "0.1.1",
  "license": "AGPL-3.0-or-later",
  "links": {
    "documentation": "https://github.com/lapismd/lapis-plugins/tree/main/packages/source-editor#readme",
    "homepage": "https://github.com/lapismd/lapis-plugins/tree/main/packages/source-editor#readme",
    "issues": "https://github.com/lapismd/lapis-plugins/issues",
    "repository": "https://github.com/lapismd/lapis-plugins"
  },
  "name": "Source Editor",
  "owner": {
    "name": "Lapis Notes",
    "url": "https://github.com/lapismd/lapis-plugins",
    "verified": true
  },
  "readme": {
    "sha256": "b7436c4c70b3c638e86e70ba8d62d8d79fbfd7894706898c2188c10dd936a09b",
    "size": 689,
    "url": "https://registry.lapis.md/v1/content/lapis-source-editor/overview.md"
  },
  "readmeUrl": "https://raw.githubusercontent.com/lapismd/lapis-plugins/8a0b4648ca934a64480c01c9116609e5e28afa73/packages/source-editor/README.md",
  "schemaVersion": 1,
  "signatures": [
    {
      "alg": "ed25519",
      "keyId": "lapis-registry-2026-06",
      "sig": "C/akX1HGf3TJoQNMjPx/C/QIYrqP7LLsmPWIZd2N+7sH0qsvqf+4Rc9+DK3bTlMm047xyo4RnejhLdi7OAC5AQ=="
    }
  ],
  "status": "active",
  "versions": {
    "0.1.1": {
      "bundle": {
        "downloadUrl": "../../download/lapis-source-editor/0.1.1",
        "sha256": "700188eec99b754a5df6e96c57b0ca243319e3fabe45cb0062ab92278148955e",
        "size": 152766,
        "url": "https://github.com/lapismd/lapis-plugins/releases/download/source-editor%400.1.1/lapis-source-editor-0.1.1.lapis-plugin"
      },
      "minAppVersion": "0.1.0",
      "platforms": [
        "web",
        "electron"
      ],
      "releasedAt": "2026-08-29T09:37:01.000Z",
      "version": "0.1.1"
    }
  }
}
