{
  "channel": "official",
  "contributes": {
    "editorViews": [
      {
        "filenamePatterns": [
          "*.lapisdoc",
          "*.lapissheet"
        ],
        "id": "lapis-docs.document",
        "label": "Lapis Document"
      }
    ]
  },
  "description": "Rich document and spreadsheet editing for Lapis.",
  "id": "lapis-docs",
  "latestVersion": "2026.6.6",
  "name": "Docs",
  "owner": {
    "name": "Lapis Notes",
    "verified": true
  },
  "readmeUrl": "https://code.ju.ma/lapis-notes/lapis/raw/branch/main/packages/plugins/plugin-docs/README.md",
  "schemaVersion": 1,
  "signatures": [
    {
      "alg": "ed25519",
      "keyId": "lapis-registry-2026-06",
      "sig": "o525suErtTkL6ssvvELyp7oD80RF5RaK9NK2dmFU4dGxyZKjH3wRuxp4QXS8FV0PjfGEGZSdlgZyOvjfpEX4Cg=="
    }
  ],
  "status": "active",
  "versions": {
    "2026.6.6": {
      "bundle": {
        "sha256": "9d52f9495c9cff26c07f88d9bc6311ba8fc563cc4b8c02c35be38599f2dd1e86",
        "size": 36011257,
        "url": "https://code.ju.ma/lapis-notes/lapis/releases/download/official-plugin-assets-lapis-docs-2026.6.6/lapis-docs-2026.6.6.lapis-plugin"
      },
      "minAppVersion": "0.20.0",
      "platforms": [
        "web",
        "electron"
      ],
      "releasedAt": "2026-06-06T22:47:06Z",
      "version": "2026.6.6"
    }
  }
}
