{
  "channel": "official",
  "content": {
    "changelog": {
      "mediaType": "text/markdown",
      "sha256": "9648faead7a874182a54f88c2668f89c38900acadc0f5ea7b04bd06a97a0dd75",
      "size": 141,
      "sourceUrl": "https://raw.githubusercontent.com/lapismd/lapis-plugins/8a0b4648ca934a64480c01c9116609e5e28afa73/packages/spellcheck/CHANGELOG.md",
      "url": "https://registry.lapis.md/v1/content/spellcheck/changelog.md"
    },
    "overview": {
      "mediaType": "text/markdown",
      "sha256": "ec1e8912c5b571caaf5676d0a750bf2a594d087b444417ac8457acbd20e3f305",
      "size": 672,
      "sourceUrl": "https://raw.githubusercontent.com/lapismd/lapis-plugins/8a0b4648ca934a64480c01c9116609e5e28afa73/packages/spellcheck/README.md",
      "url": "https://registry.lapis.md/v1/content/spellcheck/overview.md"
    }
  },
  "description": "Harper grammar and spelling diagnostics for open notes",
  "highlights": [
    "Check spelling and grammar in open notes with Harper.",
    "Review diagnostics and suggestions in editor and Problems surfaces.",
    "Configure dialect, dictionaries, rules, and file scopes per vault."
  ],
  "id": "spellcheck",
  "latestVersion": "0.1.1",
  "license": "AGPL-3.0-or-later",
  "links": {
    "documentation": "https://github.com/lapismd/lapis-plugins/tree/main/packages/spellcheck#readme",
    "homepage": "https://github.com/lapismd/lapis-plugins/tree/main/packages/spellcheck#readme",
    "issues": "https://github.com/lapismd/lapis-plugins/issues",
    "repository": "https://github.com/lapismd/lapis-plugins"
  },
  "name": "Spell Check",
  "owner": {
    "name": "Lapis Notes",
    "url": "https://github.com/lapismd/lapis-plugins",
    "verified": true
  },
  "readme": {
    "sha256": "ec1e8912c5b571caaf5676d0a750bf2a594d087b444417ac8457acbd20e3f305",
    "size": 672,
    "url": "https://registry.lapis.md/v1/content/spellcheck/overview.md"
  },
  "readmeUrl": "https://raw.githubusercontent.com/lapismd/lapis-plugins/8a0b4648ca934a64480c01c9116609e5e28afa73/packages/spellcheck/README.md",
  "schemaVersion": 1,
  "signatures": [
    {
      "alg": "ed25519",
      "keyId": "lapis-registry-2026-06",
      "sig": "8N1wE3e+NBubZhz+IxHl4xsfrOi4sYVT6QiAzCtzU591vVODRlo/rYrMk484D9e99bflI/TEUSxWnXddrtQrBQ=="
    }
  ],
  "status": "active",
  "versions": {
    "0.1.1": {
      "bundle": {
        "downloadUrl": "../../download/spellcheck/0.1.1",
        "sha256": "79a34cbdc73a5ffb12a33dfb8783e3c1d4b2a6bcd9a6b4c97cd6ba28a46da33d",
        "size": 9999885,
        "url": "https://github.com/lapismd/lapis-plugins/releases/download/spellcheck%400.1.1/spellcheck-0.1.1.lapis-plugin"
      },
      "minAppVersion": "0.1.0",
      "platforms": [
        "web",
        "electron"
      ],
      "releasedAt": "2026-08-29T09:37:08.000Z",
      "version": "0.1.1"
    }
  }
}
