{
  "channel": "official",
  "content": {
    "changelog": {
      "mediaType": "text/markdown",
      "sha256": "27faa66b3a1072c720ba07e1967aa61aafbc6f9c453e142b0478ebbaab16d0d1",
      "size": 136,
      "sourceUrl": "https://raw.githubusercontent.com/lapismd/lapis-plugins/8a0b4648ca934a64480c01c9116609e5e28afa73/packages/search/CHANGELOG.md",
      "url": "https://registry.lapis.md/v1/content/search/changelog.md"
    },
    "overview": {
      "mediaType": "text/markdown",
      "sha256": "4cf55dc3a7afb8dc59594ebf4075a2f2e215c34ebc2692f869b129cb7d3613a2",
      "size": 644,
      "sourceUrl": "https://raw.githubusercontent.com/lapismd/lapis-plugins/8a0b4648ca934a64480c01c9116609e5e28afa73/packages/search/README.md",
      "url": "https://registry.lapis.md/v1/content/search/overview.md"
    }
  },
  "description": "Search files, metadata, tags, and note content.",
  "highlights": [
    "Search file names, metadata, tags, and note content.",
    "Open results in the workspace from a reusable search panel.",
    "Expose scoped search capabilities to compatible agent tools."
  ],
  "id": "search",
  "latestVersion": "0.1.2",
  "license": "AGPL-3.0-or-later",
  "links": {
    "documentation": "https://github.com/lapismd/lapis-plugins/tree/main/packages/search#readme",
    "homepage": "https://github.com/lapismd/lapis-plugins/tree/main/packages/search#readme",
    "issues": "https://github.com/lapismd/lapis-plugins/issues",
    "repository": "https://github.com/lapismd/lapis-plugins"
  },
  "name": "Search",
  "owner": {
    "name": "Lapis Notes",
    "url": "https://github.com/lapismd/lapis-plugins",
    "verified": true
  },
  "readme": {
    "sha256": "4cf55dc3a7afb8dc59594ebf4075a2f2e215c34ebc2692f869b129cb7d3613a2",
    "size": 644,
    "url": "https://registry.lapis.md/v1/content/search/overview.md"
  },
  "readmeUrl": "https://raw.githubusercontent.com/lapismd/lapis-plugins/8a0b4648ca934a64480c01c9116609e5e28afa73/packages/search/README.md",
  "schemaVersion": 1,
  "signatures": [
    {
      "alg": "ed25519",
      "keyId": "lapis-registry-2026-06",
      "sig": "mhhMswMMHSCuLrBhO4tELWUyPyHi4LGqQtQx76Z/tN2l3Hy8yv59rIEKdhVSfgadWCLoSReH4lijDdtOwu1+Ag=="
    }
  ],
  "status": "active",
  "versions": {
    "0.1.2": {
      "bundle": {
        "downloadUrl": "../../download/search/0.1.2",
        "sha256": "709b7744c069826853b8852b98b28c6dab33f27110dc30b83102f6afda209096",
        "size": 366330,
        "url": "https://github.com/lapismd/lapis-plugins/releases/download/search%400.1.2/search-0.1.2.lapis-plugin"
      },
      "minAppVersion": "0.1.0",
      "platforms": [
        "web",
        "electron"
      ],
      "releasedAt": "2026-08-29T09:36:53.000Z",
      "version": "0.1.2"
    }
  }
}
