{
  "channel": "official",
  "content": {
    "changelog": {
      "mediaType": "text/markdown",
      "sha256": "d16070de4b1b516e30123a255567fb1f2c0c3f73ff27c0cb4a77f5d731040aee",
      "size": 132,
      "sourceUrl": "https://raw.githubusercontent.com/lapismd/lapis-plugins/8a0b4648ca934a64480c01c9116609e5e28afa73/packages/ai/CHANGELOG.md",
      "url": "https://registry.lapis.md/v1/content/ai/changelog.md"
    },
    "overview": {
      "mediaType": "text/markdown",
      "sha256": "2d3ab24da96b94a558a50cc0a996fb0928eaf1edf2be63e2320a20fa044e07f5",
      "size": 644,
      "sourceUrl": "https://raw.githubusercontent.com/lapismd/lapis-plugins/8a0b4648ca934a64480c01c9116609e5e28afa73/packages/ai/README.md",
      "url": "https://registry.lapis.md/v1/content/ai/overview.md"
    }
  },
  "description": "Provider-agnostic agent chat with ACP and optional native runtimes.",
  "highlights": [
    "Chat with provider-neutral agents inside the workspace.",
    "Review tool calls, reasoning, approvals, and results in one transcript.",
    "Switch compatible ACP agents without moving conversation ownership out of Lapis."
  ],
  "id": "ai",
  "latestVersion": "0.1.2",
  "license": "AGPL-3.0-or-later",
  "links": {
    "documentation": "https://github.com/lapismd/lapis-plugins/tree/main/packages/ai#readme",
    "homepage": "https://github.com/lapismd/lapis-plugins/tree/main/packages/ai#readme",
    "issues": "https://github.com/lapismd/lapis-plugins/issues",
    "repository": "https://github.com/lapismd/lapis-plugins"
  },
  "name": "AI",
  "owner": {
    "name": "Lapis Notes",
    "url": "https://github.com/lapismd/lapis-plugins",
    "verified": true
  },
  "readme": {
    "sha256": "2d3ab24da96b94a558a50cc0a996fb0928eaf1edf2be63e2320a20fa044e07f5",
    "size": 644,
    "url": "https://registry.lapis.md/v1/content/ai/overview.md"
  },
  "readmeUrl": "https://raw.githubusercontent.com/lapismd/lapis-plugins/8a0b4648ca934a64480c01c9116609e5e28afa73/packages/ai/README.md",
  "schemaVersion": 1,
  "signatures": [
    {
      "alg": "ed25519",
      "keyId": "lapis-registry-2026-06",
      "sig": "HXVxjBk0bC8DQKarwz7loJ0P8wdNSkkUA80E46pBt2wJ9iMcKP+dddT8fpKl9T+MGTvcgTpwWUb1tpAbpsWbDg=="
    }
  ],
  "status": "active",
  "versions": {
    "0.1.2": {
      "bundle": {
        "downloadUrl": "../../download/ai/0.1.2",
        "sha256": "3efd17a0cfeac2f35d37aea06c0492becf67e4aa79f95c960914df2f0976e77c",
        "size": 668241,
        "url": "https://github.com/lapismd/lapis-plugins/releases/download/ai%400.1.2/ai-0.1.2.lapis-plugin"
      },
      "minAppVersion": "0.1.0",
      "platforms": [
        "web",
        "electron"
      ],
      "releasedAt": "2026-08-29T09:35:55.000Z",
      "version": "0.1.2"
    }
  }
}
