{
  "channel": "official",
  "content": {
    "changelog": {
      "mediaType": "text/markdown",
      "sha256": "26844755723169619d893e1131724d14846e9cf6e2654e089ccd733d8d3004f2",
      "size": 140,
      "sourceUrl": "https://raw.githubusercontent.com/lapismd/lapis-plugins/8a0b4648ca934a64480c01c9116609e5e28afa73/packages/wordcount/CHANGELOG.md",
      "url": "https://registry.lapis.md/v1/content/wordcount/changelog.md"
    },
    "overview": {
      "mediaType": "text/markdown",
      "sha256": "ac4428e1e97d987e503045751d6eaab4f77fbc2d14e123488c9dc3408d429995",
      "size": 648,
      "sourceUrl": "https://raw.githubusercontent.com/lapismd/lapis-plugins/8a0b4648ca934a64480c01c9116609e5e28afa73/packages/wordcount/README.md",
      "url": "https://registry.lapis.md/v1/content/wordcount/overview.md"
    }
  },
  "description": "Status bar word and character count",
  "highlights": [
    "Show live word and character counts in the status bar.",
    "Estimate reading time for the active document.",
    "Update counts as editors and active files change."
  ],
  "id": "wordcount",
  "latestVersion": "0.1.1",
  "license": "AGPL-3.0-or-later",
  "links": {
    "documentation": "https://github.com/lapismd/lapis-plugins/tree/main/packages/wordcount#readme",
    "homepage": "https://github.com/lapismd/lapis-plugins/tree/main/packages/wordcount#readme",
    "issues": "https://github.com/lapismd/lapis-plugins/issues",
    "repository": "https://github.com/lapismd/lapis-plugins"
  },
  "name": "Word Count",
  "owner": {
    "name": "Lapis Notes",
    "url": "https://github.com/lapismd/lapis-plugins",
    "verified": true
  },
  "readme": {
    "sha256": "ac4428e1e97d987e503045751d6eaab4f77fbc2d14e123488c9dc3408d429995",
    "size": 648,
    "url": "https://registry.lapis.md/v1/content/wordcount/overview.md"
  },
  "readmeUrl": "https://raw.githubusercontent.com/lapismd/lapis-plugins/8a0b4648ca934a64480c01c9116609e5e28afa73/packages/wordcount/README.md",
  "schemaVersion": 1,
  "signatures": [
    {
      "alg": "ed25519",
      "keyId": "lapis-registry-2026-06",
      "sig": "y+JoiuJFFjbrBd2rPmioC4qipCBOtkg9dnlcVLq5F/iJWcsn4Qd3ZGH8chNUFUt2/ayoNWUUkXHhYtPIlXARAw=="
    }
  ],
  "status": "active",
  "versions": {
    "0.1.1": {
      "bundle": {
        "downloadUrl": "../../download/wordcount/0.1.1",
        "sha256": "3364e3f1c760fd06ee24e614b774b276dcbd6a15147b39c0d1b5e778beeb6cf2",
        "size": 50493,
        "url": "https://github.com/lapismd/lapis-plugins/releases/download/wordcount%400.1.1/wordcount-0.1.1.lapis-plugin"
      },
      "minAppVersion": "0.1.0",
      "platforms": [
        "web",
        "electron"
      ],
      "releasedAt": "2026-08-29T09:37:16.000Z",
      "version": "0.1.1"
    }
  }
}
