{
  "channel": "official",
  "content": {
    "changelog": {
      "mediaType": "text/markdown",
      "sha256": "a7fe6a95f375138aed322649f723010fca479e3429989221ae3541f0db2df159",
      "size": 137,
      "sourceUrl": "https://raw.githubusercontent.com/lapismd/lapis-plugins/8a0b4648ca934a64480c01c9116609e5e28afa73/packages/history/CHANGELOG.md",
      "url": "https://registry.lapis.md/v1/content/history/changelog.md"
    },
    "overview": {
      "mediaType": "text/markdown",
      "sha256": "7912cf3a7ed9b15b2a635c79352469224b61b2be2a70b958a08a4fa2242cfa3f",
      "size": 614,
      "sourceUrl": "https://raw.githubusercontent.com/lapismd/lapis-plugins/8a0b4648ca934a64480c01c9116609e5e28afa73/packages/history/README.md",
      "url": "https://registry.lapis.md/v1/content/history/overview.md"
    }
  },
  "description": "File history",
  "highlights": [
    "Capture bounded local revisions as vault files change.",
    "Compare saved revisions with the current document.",
    "Restore selected content through the normal vault write path."
  ],
  "id": "history",
  "latestVersion": "0.1.2",
  "license": "AGPL-3.0-or-later",
  "links": {
    "documentation": "https://github.com/lapismd/lapis-plugins/tree/main/packages/history#readme",
    "homepage": "https://github.com/lapismd/lapis-plugins/tree/main/packages/history#readme",
    "issues": "https://github.com/lapismd/lapis-plugins/issues",
    "repository": "https://github.com/lapismd/lapis-plugins"
  },
  "name": "History",
  "owner": {
    "name": "Lapis Notes",
    "url": "https://github.com/lapismd/lapis-plugins",
    "verified": true
  },
  "readme": {
    "sha256": "7912cf3a7ed9b15b2a635c79352469224b61b2be2a70b958a08a4fa2242cfa3f",
    "size": 614,
    "url": "https://registry.lapis.md/v1/content/history/overview.md"
  },
  "readmeUrl": "https://raw.githubusercontent.com/lapismd/lapis-plugins/8a0b4648ca934a64480c01c9116609e5e28afa73/packages/history/README.md",
  "schemaVersion": 1,
  "signatures": [
    {
      "alg": "ed25519",
      "keyId": "lapis-registry-2026-06",
      "sig": "9JvsGgP0jTqXlgPfLjtaNm2dVPB8mxeVXOlw+M328fqOQ71aNMZYg/vLpYNu+9maVIUTEeewkgQi30kNBAhUDw=="
    }
  ],
  "status": "active",
  "versions": {
    "0.1.2": {
      "bundle": {
        "downloadUrl": "../../download/history/0.1.2",
        "sha256": "d07dc0b6fc4afa87f8d2fdbcac86f15f5bf6efdd946d60c04bccd2bda12b9060",
        "size": 148095,
        "url": "https://github.com/lapismd/lapis-plugins/releases/download/history%400.1.2/history-0.1.2.lapis-plugin"
      },
      "minAppVersion": "0.1.0",
      "platforms": [
        "web",
        "electron"
      ],
      "releasedAt": "2026-08-29T09:36:30.000Z",
      "version": "0.1.2"
    }
  }
}
