{
  "channel": "official",
  "contributes": {
    "editorViews": [
      {
        "filenamePatterns": [
          "*.canvas"
        ],
        "id": "lapis-canvas.editor",
        "label": "Canvas"
      }
    ]
  },
  "description": "Infinite canvas view with JSON Canvas support.",
  "id": "lapis-canvas",
  "latestVersion": "2026.6.6",
  "name": "Canvas",
  "owner": {
    "name": "Lapis Notes",
    "verified": true
  },
  "readmeUrl": "https://code.ju.ma/lapis-notes/lapis/raw/branch/main/packages/plugins/plugin-canvas/README.md",
  "schemaVersion": 1,
  "signatures": [
    {
      "alg": "ed25519",
      "keyId": "lapis-registry-2026-06",
      "sig": "y8Nc7WEhyPF45gKM5KHyJzk27nGBt/JSDD4hOeV6Rl3706/MZfgb0VwqfDw/+kqm/K4OvZKtp6RWleYnYxpGAA=="
    }
  ],
  "status": "active",
  "versions": {
    "2026.6.6": {
      "bundle": {
        "sha256": "f8ab63f9c2b258e94d1824a169009e64bf3c5bbdb9b874729c96235b63e66ef3",
        "size": 164184,
        "url": "https://code.ju.ma/lapis-notes/lapis/releases/download/official-plugin-assets-lapis-canvas-2026.6.6/lapis-canvas-2026.6.6.lapis-plugin"
      },
      "minAppVersion": "1.7.7",
      "platforms": [
        "web",
        "electron"
      ],
      "releasedAt": "2026-06-06T22:47:29Z",
      "version": "2026.6.6"
    }
  }
}
